{
  "schema_version": "1.0.0",
  "job_id": "job-draft-001",
  "trace_id": "trace-a08-b08-demo-001",
  "pair_id": "A08-B08",
  "idempotency_key": "b08-draft-001",
  "job_type": "DRAFT",
  "status": "SUCCEEDED",
  "created_at": "2026-09-17T09:00:00+08:00",
  "updated_at": "2026-09-17T09:04:12+08:00",
  "input": {
    "subject": {
      "repository_url": "https://github.com/example/b08-demo.git",
      "commit": "0123456789abcdef0123456789abcdef01234567",
      "configuration_id": "ubuntu-22.04-gcc-11-release"
    },
    "context_documents": ["README.md", "INSTALL.md"],
    "build": {
      "working_directory": "/workspace",
      "build_command": "make -j2",
      "verify_command": "./bin/demo --version",
      "max_iterations": 8,
      "timeout_seconds": 900,
      "base_image_hint": "ubuntu:22.04"
    }
  },
  "output": {
    "dockerfile": {
      "artifact_id": "dockerfile-draft-001",
      "type": "DOCKERFILE",
      "uri": "artifact://a08-b08/draft-001/Dockerfile",
      "media_type": "text/x-dockerfile",
      "producer_job_id": "job-draft-001",
      "subject": {
        "repository_url": "https://github.com/example/b08-demo.git",
        "commit": "0123456789abcdef0123456789abcdef01234567",
        "configuration_id": "ubuntu-22.04-gcc-11-release"
      },
      "sha256": "725c606a821e9e20b51f6b51df337e068626977ab782922f89a51fca520d6af2"
    },
    "container_image": {
      "artifact_id": "image-draft-001",
      "type": "CONTAINER_IMAGE",
      "uri": "docker://a08-b08/b08-demo:0123456",
      "media_type": "application/vnd.oci.image.manifest.v1+json",
      "producer_job_id": "job-draft-001",
      "subject": {
        "repository_url": "https://github.com/example/b08-demo.git",
        "commit": "0123456789abcdef0123456789abcdef01234567",
        "configuration_id": "ubuntu-22.04-gcc-11-release"
      }
    },
    "iteration_log": {
      "artifact_id": "logs-draft-001",
      "type": "BUILD_LOG_BUNDLE",
      "uri": "artifact://a08-b08/draft-001/iterations.json",
      "media_type": "application/json",
      "producer_job_id": "job-draft-001",
      "subject": {
        "repository_url": "https://github.com/example/b08-demo.git",
        "commit": "0123456789abcdef0123456789abcdef01234567",
        "configuration_id": "ubuntu-22.04-gcc-11-release"
      },
      "sha256": "f6517d6b85836b8b4d60f2d0b36bbb733973a35de24c0ff9dd7de9e7f449b735"
    },
    "build_verification": {
      "build_exit_code": 0,
      "verify_exit_code": 0,
      "verdict": "PASSED"
    }
  },
  "error": null
}
