{
  "schema_version": "1.0.0",
  "job_id": "job-full-001",
  "trace_id": "trace-a08-b08-demo-001",
  "pair_id": "A08-B08",
  "idempotency_key": "a08-full-check-001",
  "job_type": "FULL_CHECK",
  "status": "SUCCEEDED",
  "created_at": "2026-09-17T09:10:00+08:00",
  "updated_at": "2026-09-17T09:12:48+08:00",
  "input": {
    "subject": {
      "repository_url": "https://github.com/example/b08-demo.git",
      "commit": "0123456789abcdef0123456789abcdef01234567",
      "configuration_id": "ubuntu-22.04-gcc-11-release"
    },
    "environment": {
      "container_image": {
        "artifact_id": "image-draft-001",
        "type": "CONTAINER_IMAGE",
        "uri": "docker://a08-b08/b08-demo:0123456",
        "media_type": "application/vnd.oci.image.manifest.v1+json",
        "producer_job_id": "job-draft-001",
        "subject": {
          "repository_url": "https://github.com/example/b08-demo.git",
          "commit": "0123456789abcdef0123456789abcdef01234567",
          "configuration_id": "ubuntu-22.04-gcc-11-release"
        }
      },
      "working_directory": "/workspace"
    },
    "clean_build_command": "make clean && make -j2"
  },
  "output": {
    "actual_graph": {
      "artifact_id": "actual-graph-full-001",
      "type": "ACTUAL_GRAPH",
      "uri": "artifact://a08-b08/full-001/actual.json",
      "media_type": "application/json",
      "producer_job_id": "job-full-001",
      "subject": {
        "repository_url": "https://github.com/example/b08-demo.git",
        "commit": "0123456789abcdef0123456789abcdef01234567",
        "configuration_id": "ubuntu-22.04-gcc-11-release"
      },
      "sha256": "c112b4c8f6ad3616093b3cbb4bc311f67955677de7c0373ebc1498f622deca19"
    },
    "declared_graph": {
      "artifact_id": "declared-graph-full-001",
      "type": "DECLARED_GRAPH",
      "uri": "artifact://a08-b08/full-001/declared.json",
      "media_type": "application/json",
      "producer_job_id": "job-full-001",
      "subject": {
        "repository_url": "https://github.com/example/b08-demo.git",
        "commit": "0123456789abcdef0123456789abcdef01234567",
        "configuration_id": "ubuntu-22.04-gcc-11-release"
      },
      "sha256": "ded724f306d318388cca87e2f80ba22dc48d991db3813c04a090a4ab702d5fa1"
    },
    "error_report": {
      "artifact_id": "md-report-full-001",
      "type": "ERROR_REPORT",
      "uri": "artifact://a08-b08/full-001/error-report.json",
      "media_type": "application/json",
      "producer_job_id": "job-full-001",
      "subject": {
        "repository_url": "https://github.com/example/b08-demo.git",
        "commit": "0123456789abcdef0123456789abcdef01234567",
        "configuration_id": "ubuntu-22.04-gcc-11-release"
      },
      "sha256": "9b0566536191136a3a76ae871a7142e5d917c3ab9db0895bbe67be443b92e1c4"
    },
    "summary": {
      "missing": 1,
      "redundant": 0
    }
  },
  "error": null
}
