{
  "schema_version": "1.0.0",
  "job_id": "job-repair-001",
  "trace_id": "trace-a08-b08-demo-001",
  "pair_id": "A08-B08",
  "idempotency_key": "b08-repair-001",
  "job_type": "REPAIR",
  "status": "QUEUED",
  "created_at": "2026-09-17T10:00:00+08:00",
  "updated_at": "2026-09-17T10:00:00+08:00",
  "input": {
    "subject": {
      "repository_url": "https://github.com/example/b08-demo.git",
      "commit": "0123456789abcdef0123456789abcdef01234567",
      "configuration_id": "ubuntu-22.04-gcc-11-release"
    },
    "environment": {
      "image_ref": "docker://a08-b08/b08-demo:0123456",
      "working_directory": "/workspace"
    },
    "md_report": {
      "artifact_id": "md-report-full-001",
      "type": "ERROR_REPORT",
      "uri": "artifact://a08-b08/full-001/error-report.json",
      "media_type": "application/json",
      "producer_job_id": "job-full-001",
      "subject": {
        "repository_url": "https://github.com/example/b08-demo.git",
        "commit": "0123456789abcdef0123456789abcdef01234567",
        "configuration_id": "ubuntu-22.04-gcc-11-release"
      }
    },
    "makefile_path": "Makefile",
    "validation": {
      "build_command": "make clean && make -j2",
      "test_command": "make test",
      "recheck_endpoint": "/v1/full-check-jobs"
    }
  },
  "output": null,
  "error": null
}
